{
  "name": "coordinator",
  "description": "Coordinates child specs and manages integration",
  "prompt_file": "coordinator.md",
  "allowed_tools": [
    "Read",
    "Grep",
    "Glob"
  ],
  "forbidden_tools": [
    "Edit",
    "Write",
    "Bash",
    "NotebookEdit"
  ],
  "mode": "read_only",
  "max_iterations": 10,
  "timeout_minutes": 15
}
