{
  "name": "architect",
  "description": "High-level system architecture and decomposition",
  "prompt_file": "architect.md",
  "allowed_tools": [
    "Read",
    "Grep",
    "Glob",
    "Bash",
    "WebSearch"
  ],
  "forbidden_tools": [
    "Edit",
    "Write",
    "NotebookEdit"
  ],
  "mode": "read_only",
  "max_iterations": 5,
  "timeout_minutes": 15
}
